,url,content
158,https://v.daum.net/v/20220612194817552,"한국기계연구원이 화재 발생 초기에 이를 인식해 자동으로 소화수를 분사해 진압할 수 있는 '자율형 초동진압 소화체계'를 개발했다. 사진은 화재 발생 위치에 소화수를 자동으로 뿌리고 있는 초동진압 소화체계 모습. <기계연 제공> 화재를 초기에 인식하고 자동으로 소화수를 뿌려 진압할 수 있는 AI(인공지능) 기반 소화기술이 개발됐다. 화물선, 여객선, 해양플랜트 등 해상뿐 아니라 소방 사다리를 사용할 수 없는 초고층 아파트 등에 활용 가능할 전망이다. 한국기계연구원은 정정훈 박사팀이 화재 발생 초기에 신속하게 진압할 수 있는 '자율형 초동진압용 소화체계'를 개발했다고 12일 밝혔다. 기존 소화설비는 화재 감지 시 스프링쿨러 등이 공간 전체에 소화수를 분사하는 방식이다. 화재 허위 경보가 울릴 경우 해당 공간에 불필요한 소화수를 뿌리면 피해가 커 수동으로 작동하는 경우가 많았다. 연구팀이 개발한 소화체계는 화재와 비화재 상황을 AI가 학습해 실제 화재에만 작동하도록 설계됐다. 공간 전체에 소화수를 분사하는 것이 아니라 소방관이 직접 하는 것처럼 불이 시작된 곳에 직접 조준 분사하는 방식이다. 소화체계는 화재탐지센서, 소화 모니터, AI를 이용해 화재 진위여부 판단 및 화재위치 추정 등을 위한 분석·제어장치로 구성돼 있다. 화재감지 정확도는 98% 이상, 소화수는 최대 65㎝까지 분사 가능하다. 화재 발생 초기나 화재 규모가 작은 상황에 자율적으로 소화수를 조준 분사함으로써 골든타임 내에 화재 확산을 근본적으로 차단하고, 주변 장비와 설비 등의 피해를 최소화할 수 있다. 또한 선박동작 모사장치와 시뮬레이션을 통해 각종 함정과 탄약고, 군수품 창고, 항공기 격납고, 물류창고 등에 적용할 수 있다. 정정훈 기계연 박사는 ""자율형 초동진압 소방체계는 화재로 인한 인명과 재산 피해를 줄이는 데 유용할 것""이라며 ""여러 구획에서 동시 다발적으로 화재가 발생하는 함정의 경우 여러 구획의 화재를 초기에 진압함으로써 전투력과 승조원 생명 유지에 기여할 것""이라고 말했다.이준기기자 bongchu@dt.co.kr Copyrights ⓒ 디지털타임스 & dt.co.kr, 무단 전재 및 재배포 금지"
159,https://v.daum.net/v/20220612194100490,"기계연 연구진이 자율형 초동진압용 소화체계 설비로 소화실험을 진행하고 있다. 왼쪽 위 소화모니터에서 오른쪽 아래 화원으로 소화수를 조준 분사하는 모습.[한국기계연구원 제공] [헤럴드경제=구본혁 기자] 화재 발생 초기에 인공지능(AI)이 진짜 화재인지 정확하게 인식하고 자동으로 화원(火源)에 소화수를 조준 분사해 진압할 수 있는 기술이 국내 최초로 개발됐다. 한국기계연구원 기계시스템안전연구본부 정정훈 박사 연구팀은 화재 발생 초기에 신속하게 화재를 진압할 수 있는 자율형 초동진압용 소화체계를 개발했다. 자율형 초동진압용 소화체계는 기존 소화설비의 부족한 점을 보완할 수 있는 신개념 기술이다. 화재 발생 초기, 화재가 소규모인 상태에서 자율적으로 화원에 소화수를 조준 분사하여 진압함으로써, 골든타임 내에 화재 확산을 근본적으로 차단하고 주변 장비, 설비 등의 피해를 최소화 할 수 있다. 화재진압을 위해 함정, 건물 등에 설치된 스프링클러 등 기존의 소화설비는 화재 감지 시 공간 전체에 소화수를 분사하는 형태다. 화재 허위경보가 울릴 경우 해당 공간에 불필요한 소화수가 분사되면 피해가 크므로 수동으로 작동시키는 경우가 많았다. 이번에 기계연에서 개발한 자율형 소화체계는 화재 및 비화재 상황을 학습해 실제 화재에만 작동할 수 있도록 고안됐다. 공간 전체에 소화수를 분사하는 것이 아닌 소방관이 불을 끄는 것처럼 화원에 직접 조준 분사하는 형태라 화원 외 공간의 피해가 적다. 연구팀이 개발한 자율형 초동진압용 소화체계는 화재탐지센서, 소화모니터, 인공지능을 이용한 화재 진위여부 판단, 화재위치 추정과 소화모니터를 제어하는 분석 및 제어장치로 구성돼 있다. 자율형 초동진압용 소화체계 개념도.[한국기계연구원 제공] 연구팀은 화재감지 정확도를 98% 이상, 소화수는 최대 65m까지 분사 가능하도록 구현했다. 또한 선박동작 모사 장치와 시뮬레이션을 통해 해상상태 3 이상에서 개발된 소화체계가 정상작동 하는지를 검증해 함정 적용 가능성을 확인했다. 이 기술은 각종 함정뿐만 아니라 탄약고, 군수품창고, 항공기 격납고, 물류창고 등에 적용 가능하다. 특히 전투상황에서 피격에 의해 함정의 여러 구획에서 동시 다발적으로 화재가 발생하는 경우, 자율기능으로 여러 구획의 화재를 초기에 진압함으로써 전투력 유지 및 생존성 향상에 크게 도움이 된다. 정정훈 박사는 “이번에 개발한 자율형 초동진압 소화체계는 화재로 인한 인명과 재산 피해를 감소시킬 수 있을 뿐만 아니라 심화되고 있는 함정 승조원 수 절감에 효과적인 대처에도 의의가 있다”며 “향후 군수 분야와 함께 차량운반선, 화물선, 여객선, 해양플랜트, 소방 사다리를 사용할 수 없는 초고층아파트 등에 설치 시 빠른 화재진압이 가능할 것으로 기대한다”고 밝혔다. nbgkoo@heraldcorp.com ⓒ 헤럴드경제 & heraldbiz.com, 무단 전재 및 재배포 금지"
160,https://v.daum.net/v/20220612191544207,"고(故) 명성호 한국전기연구원장. /한국전기연구원 한국전기연구원(KERI)은 지난 10일 명성호 원장이 뇌출혈로 별세했다고 전했다. 향년 63세. 광주에서 태어난 고인은 1981년 서울대 전기공학과를 졸업하고, 같은 대학에서 석사(1983년)와 박사(1996년) 학위를 받았다. 1985년부터 KERI에서 전기환경송전연구그룹장, 차세대전력망연구본부장, 미래전략실장, 연구부원장, 시험부원장을 차례로 역임했고, 지난해 8월 제14대 원장으로 취임했다. 명 원장의 주요 연구개발(R&D) 업적으로는 ‘전력설비 전자계 해석 및 평가 프로그램 개발’이 있다. 이는 송전선로나 변전소 등 전력설비에서 발생하는 전자계가 어느 정도인지 예측해 기기 및 인체에 어떠한 영향을 미치는지 평가하는 기술이다. 그동안 해외에 의존했던 프로그램을 국산화한 성과로, 국내 전력설비의 품질과 안전성을 크게 높인 것으로 평가받는다. 연구원 내부에서는 직급에 상관없이 모두가 평등 공정한 방식으로 의견을 제시하고, 집단 지성을 발휘할 수 있는 ‘상향적 혁신’을 강조하는 등 새로운 조직문화 구축에 힘써온 것으로 알려졌다. 유족은 부인 심효정 씨와 2남(명제학, 명승현)이 있다. 영결식은 13일 고려대 안암병원 장례식장에서 진행되고, 고인의 유해는 성남 영생원에서 화장된 뒤 분당 봉안당 홈에 안장될 예정이다. - Copyrights ⓒ 조선비즈 & Chosun.com, 무단 전재 및 재배포 금지 -"
161,https://v.daum.net/v/20220612191526204,"[한국경제TV 이영호 기자] 국내 5대 가상화폐 거래소들이 '코인 상장과 상장 폐지 관련 자율 규약'을 발표한다. 코인 투자자들에게 큰 손실을 입힌 '루나·테라 대폭락 사태'의 후속 조치로 국내 가상화폐 거래소들이 공동 협의체를 만들어 시장 혼란을 방지하는 시스템을 구축하는 작업도 추진된다. 국민의힘과 정부가 13일 국회에서 개최하는 '가상자산 시장의 공정성 회복과 투자자 보호를 위한 2차 정책간담회'에는 업비트·빗썸·코인원·코빗·고팍스 등 국내 5대 가상화폐 거래소가 참석해 이같은 내용의 자율규약 초안을 공개할 예정이다. '루나 대폭락 사태'와 유사한 긴급 상황이 발생했을 경우 주요 거래소들이 협업 체계를 통해 공동으로 대응할 수 있도록 기반을 마련해두겠다는 취지다. 앞서 지난 9일 한국디지털자산사업자연합회(KDA)는 국내 5대 가상화폐 거래소가 마련할 공동대응 방안을 원칙적으로 수용하고, 코인마켓 거래소의 특성에 맞는 공시 등 기준과 절차를 공동으로 제정할 예정이라고 밝힌 바 있다. 이번 간담회에는 당에서 성일종 정책위의장과 전반기 국회 정무위원장을 지낸 윤재옥 의원, 후반기 정무위 간사로 내정된 윤한홍 의원과 가상자산특위 소속 의원들이 참석한다. 정부에서는 김소영 금융위 부위원장, 이복현 금융감독원장 등이 참석할 예정이다. 이영호기자 hoya@wowtv.co.kr Copyright 한국경제티브이"
162,https://v.daum.net/v/20220612190127057,"네이버 커넥트재단 유아동 교육 플랫폼 쥬니버스쿨. 네이버 제공 네이버 커넥트재단 유아동 교육 플랫폼 쥬니버스쿨이 아이들의 공감 능력 발달을 위해 지난 2일 사회성 과목을 추가하고 31개의 교육 콘텐츠를 새롭게 공개했다. 이번에 새롭게 출시된 쥬니버스쿨의 사회성 과목은 소아정신 분야 국내 최고 권위자인 세브란스병원 소아정신과 천근아 교수팀과 긴밀히 협력한 결과다. 네이버 커넥트재단과 연세의료원은 작년 9월 유아기 어린이들을 위한 사회성 교육 콘텐츠 개발을 위한 공동연구개발 협약(MOU)을 체결한 바 있다. 쥬니버스쿨 사회성 교육 콘텐츠 개발에 참여한 세브란스병원 소아정신과 천근아 교수는 “사회성은 타인과 친밀한 관계를 형성하고 다양한 갈등을 해결하는 능력으로, 세상을 받아들이기 시작하는 유아기에 가장 우선적으로 발달돼야 한다”며 “쥬니버스쿨의 사회성 교육은 코로나19로 타인과의 상호작용이 줄어든 아이들에게 특히 유익한 교육이 될 것”이라고 말했다. 현재 쥬니버스쿨은 인공지능 시대를 살아갈 아이들이 논리적 사고력과 문제 해결 능력을 기를 수 있도록 코딩, 논리, 수학, 실험실, 사회성까지 총 5과목의 기초교육을 제공하고 있다. 광고나 유해 콘텐츠 걱정 없이 학부모와 아이들이 339개의 교육 콘텐츠를 무료로 안전하게 이용할 수 있다. 쥬니버스쿨은 작년 8월 출시 이후 누적 다운로드 12만6000건을 돌파하며 큰 인기를 끌고 있다. 네이버 커넥트재단 조규찬 이사장은 “인공지능, 데이터, 코딩 등 기초 IT 교육뿐 아니라 아이들이 윤리와 도덕성을 갖춘 건강한 사회구성원으로 성장할 수 있도록 국내외 최고 권위의 연구진과 협력해 쥬니버스쿨의 커리큘럼을 확대해 나가겠다”고 말했다. 현화영 기자 hhy@segye.com ⓒ 세계일보 & Segye.com, 무단 전재 및 재배포 금지"
163,https://v.daum.net/v/20220612185927023,"[이데일리 김현아 기자] 故 명성호 한국전기연구원 원장 한국전기연구원(KERI) 명성호(明聖鎬, 59년생) 원장이 지난 10일 뇌출혈로 별세했다. 향년 63세. 광주에서 태어난 명 원장은 1981년 서울대 전기공학과를 졸업하고, 동 대학에서 석사(1983년) 및 박사(1996년) 학위를 취득했다. 한국전기연구원과는 1985년부터 인연을 맺으며 전기환경송전연구그룹장, 차세대전력망연구본부장, 미래전략실장, 연구부원장, 시험부원장을 차례로 역임했고, 지난해 8월 한국전기연구원 제14대 원장으로 임명됐다. 대외적으로는 국제대전력망회의(CIGRE) 전기환경 부문 한국대표, 한전 열린경영위원, 경남테크노파크 이사, 한국에너지학회 이사, 대한전기협회 한국기술기준위원회 위원, 한국전기산업진흥회 운영 위원 등을 맡았다. 명성호 원장의 주요 연구개발 업적으로는 ‘전력설비 전자계 해석 및 평가 프로그램 개발’이 있다. 송전선로나 변전소 등 전력설비에서 발생되는 전자계가 어느 정도인지 예측하여 기기 및 인체에 어떠한 영향을 미치는지 평가하는 기술이다. 해외에 의존했던 프로그램을 국산화한 성과로, 국내 전력설비의 품질과 안전성을 크게 높인 것으로 평가받고 있다. 이 외에도 ▲765kV 초고압 송전선로 상용화 기술 개발 ▲350km/h 한국형 고속철도 전자파 대책기술 개발 및 안전성 확보 ▲낙뢰 및 고출력 전자기파(EMP)로부터 국가 기간시설을 보호하는 핵심기술 개발 등의 굵직한 연구성과를 거뒀다. 2014년부터는 연구부원장직을 맡아 본격적으로 기관의 경영 업무를 수행하며 주요사업 운영체계 개선 및 조직 재정비, 연구원 역할과 책임(R&R) 정립 등에 기여했고, 시험부원장 재직 시기(‘16~’18)에는 4000MVA 대전력시험설비 증설사업 성공적 완수, 통합시험운영시스템 구축 등을 효과적으로 이끌어 국내 전력기기 업계의 경쟁력 강화에도 큰 역할을 했다. 지난해 8월에는 제14대 한국전기연구원장으로 선임되어 ‘미래시대 전기화 세상(Electrified World)의 중심 KERI’를 비전으로 삼아 국민과 기업이 체감할 수 있는 성과 창출에 많은 노력을 기울였다. 임기 중 대표 연구성과로는 ▲전기차용 SiC 전력반도체 국산화 및 양산 기반 마련 ▲고용량 리튬이온전지용 실리콘/그래핀 복합 음극재 기술이전 ▲암 치료용 선형가속기 및 마그네트론 기술 국산화 개발 ▲전고체전지용 황화물계 고체전해질 대량생산 기술이전 등이 있다. 특히 그는 전기기술을 통한 지역상생 발전에 힘썼다. ▲캐나다 워털루 대학과의 AI 협력을 통한 부산·창원 지역기업 제조 혁신 ▲국내 전력기기 업체 수출 저변 확대를 위한 ‘HVDC 전력기기 국제공인 시험인증센터’ 착공 ▲경남 창원 강소연구개발특구 사업 활성화 지원 ▲지역 스타트업 활성화를 위한 ‘기술창업센터’ 증축 ▲전기 신소재·부품 기술 자립을 위한 ‘e-나노소재 화학/습식공정 플랫폼’ 착공 ▲탄소중립 실현을 위한 ‘광주 레독스흐름전지 시험인증센터’ 구축 등의 성과를 통해 지역 산업 경쟁력을 높이는 데 큰 역할을 했다. 연구원 내부적으로는 직급에 상관없이 모두가 평등 공정한 방식으로 의견을 제시하고, 집단 지성을 발휘할 수 있는 ‘상향적 혁신’을 강조하는 등 새로운 조직문화 구축에 힘써 왔다. 합리적이면서 온화한 성격의 명 원장은 평소에도 직원들과 적극 소통하며 많은 존경과 사랑을 받았다. 유족은 부인 심효정씨와 2남(명제학, 명승현)이 있다. 영결식은 13일 고려대 안암병원 장례식장에서 진행되고, 고인의 유해는 성남 영생원에서 화장된 뒤 분당 봉안당 홈에 안장될 예정이다. 김현아 (chaos@edaily.co.kr) ⓒ종합 경제정보 미디어 이데일리 - 무단전재 & 재배포 금지"
164,https://v.daum.net/v/20220612185654999,"콘서트 전경. 스마일게이트 제공 게임사 스마일게이트가 ‘로스트아크’ OST로 진행한 첫 콘서트에서 높은 반응을 이끌어냈다. 로스트아크 개발사 스마일게이트RPG에 따르면 지난 3일 서울 송파구 롯데콘서트홀에서 진행한 콘서트 ‘디어 프렌즈(Dear. Friends)’가 온라인 생방송 동시 시청자 수 21만명, 누적 조회수 170만(3일차 기준)을 기록했다. 1200석 규모의 오프라인 콘서트 티켓은 예매 시작 1분 만에 매진된 바 있다. 이번 콘서트는 로스트아크의 OST를 풀 오케스트라, 헤비메탈, 국악, 뮤지컬 등으로 재해석해 새삼 화제를 샀다. 오케스트라는 KBS 교향악단과 구리 시립 합창단, 천안 시립 합창단, 마포구립 소년 소녀 합창단이 무대를 꾸몄다. 특히 게임 개발을 총괄해온 금강선 디렉터가 현장에서 콘서트를 진행해 게이머의 좋은 반응을 얻었다. 금강선 디렉터(오른쪽)가 콘서트에서 발언하고 있다. 스마일게이트 제공 스마일게이트RPG는 이번 콘서트의 티켓 판매 수익금을 포함한 OST 관련 수익금 전액을 게임 이용자의 이름으로 기부할 예정이다. 스마일게이트RPG 지원길 대표는 “이번 콘서트가 종합예술로서 ‘게임’의 위상을 높이고 인정받을 수 있는 대표 사례가 되기를 기원한다”고 밝혔다. 이다니엘 기자 dne@kmib.co.kr GoodNews paper ⓒ 국민일보 . 무단전재 및 재배포금지"
165,https://v.daum.net/v/20220612185026936,"업비트, 빗썸, 코인원 등 국내 3대 코인거래소는 가상자산 ‘무비블록(MBL)’을 유의 종목으로 지정했다. [헤럴드경제=김현일 기자] “이러다가 상장폐지되는 거 아니죠?” “얼마나 호구로 알면 유통량을 속입니까?”(가상자산 ‘무비블록’ 투자자들) 국내 동영상 플랫폼 판도라TV의 가상자산 ‘무비블록(MBL)’이 업비트, 빗썸, 코인원 등 국내 3대 코인거래소에서 일제히 유의 종목으로 지정되면서 투자자들이 원성을 쏟아내고 있다. 업비트는 지난 9일 홈페이지 공지사항을 통해 “무비블록 유통량 계획정보의 신뢰성에 문제가 있다고 판단했다”며 유의 종목 지정 사실을 알렸다. 업비트는 공지사항을 통해 “무비블록 유통량 계획 정보의 신뢰성에 문제가 있다고 판단했다”며 유의종목 지정 사실을 알렸다. [업비트 홈페이지] 무비블록 측이 가상자산 공시 포털 쟁글과 다른 거래소에 제출한 유통량 계획정보가 업비트에 제출한 유통량 계획정보와 달랐다는 점이 그 이유로 지목됐다. 또한 일부 유통량 계획정보와 실제 유통량에도 차이가 있는 점을 확인했다고 업비트는 설명했다. 빗썸도 유의 종목 지정을 알리며 “2분기 무비블록 유통량과 실제 유통량이 상이한 것으로 확인돼 투자자 보호를 위한 방안을 확인 중”이라고 밝혔다. 무비블록 가격은 유의 종목 지정 이후 12일 오후까지 약 36% 급락하며 크게 흔들리는 상황이다. 이례적으로 3대 거래소에서 동시에 유의 종목으로 지정된 만큼 투자자들은 이러다 상장폐지되는 것 아니냐며 주말 내내 불안감을 호소하고 있다. 무비블록 측은 홈페이지를 통해 “투자유의 종목 지정으로 우려를 드린 점에 대해 사과의 말씀을 드린다”고 밝혔다. [무비블록 홈페이지] 앞서 무비블록은 가상자산시장이 얼어붙은 지난 3월에도 한 달간 약 34% 급등하며 가상자산 투자자들의 관심을 받았다. 가상자산 시세정보 사이트 코인마켓캡에 따르면 무비블록의 시가총액은 지난 3월 21일 3256억원으로, 올해 최고치를 찍었다. 그러나 유의 종목으로 지정받으면서 이날 현재 589억원으로 쪼그라들었다. 불과 석 달 만에 약 2700억원 증발한 셈이다. 무비블록 측은 홈페이지를 통해 “투자 유의 종목 지정으로 우려를 드린 점에 대해 사과의 말씀을 드린다”며 “유의 종목 지정 해제를 위해 대응하고 있다. 프로젝트에 대한 신뢰를 회복하기 위해 더 노력할 것을 약속드린다”고 진화에 나섰다. 그러나 유의 종목에서 벗어나기 위해선 무비블록 측의 충분한 해명이 필요한 상황이다. 업비트는 유통량 차이에 대한 무비블록의 소명이 충분한지 등을 종합적으로 검토할 예정이다. 완벽히 소명되지 않을 경우 무비블록의 거래 지원은 종료된다. joze@heraldcorp.com ⓒ 헤럴드경제 & heraldbiz.com, 무단 전재 및 재배포 금지"
166,https://v.daum.net/v/20220612184520892,"(지디넷코리아=이한얼 기자)김준 SK이노베이션 부회장은 11일(현지시간) “차별적 기술 기반 무탄소·저탄소 에너지와 순환경제 중심 친환경 포트폴리오를 개발해 미래 성장을 추진하겠다“며 “전기가 에너지 핵심이 되는 전동화, 폐기물·소재 재활용(Recycle) 등에 초점을 맞춰 포트폴리오를 구축해 나갈 것”이라고 밝혔다. 김 부회장은 이날 미국 서부 캘리포니아주 새너제이에서 열린 ‘SK이노베이션 글로벌 포럼’에서 “전 세계 에너지는 기후위기에 맞서 탄소중립을 추구하는 트렌드에 따라 무탄소·저탄소 에너지로 빠르게 변하고 있다”며 “폐기물을 줄여 오염을 방지하고 효율적으로 자원을 활용하는 순환경제 또한 변화의 핵심”이라며 이같이 말했다. 글로벌 포럼은 SK그룹이 미래 신성장동력 발굴을 위해 개최하는 행사로 지난 2012년시작해 주요 관계사가 참여한 가운데 열리고 있다. SK이노베이션은 11~12일 무탄소·저탄소 에너지, 자원순환, 차세대 배터리 등 사업 분야와 관련한 포럼을 열어 현지 산학 전문가와 토론하는 한편, 인사이트를 공유하며 다양한 의견을 나눈다. SK이노베이션 김준 부회장이 11일(현지시간) 미국 캘리포니아주 새너제이에서 열린 ‘SK이노베이션 글로벌 포럼’ 기조연설에서 SK이노베이션의 친환경 비즈니스 포트폴리오 구축 방향과 비즈니스 모델 혁신 의지를 소개하고 있다. 포럼에는 김 부회장을 비롯해 지동섭 SK온 사장 등 SK이노베이션 계열 주요 경영진이 참석했다. SK이노베이션은 SK온(배터리), SKIET(배터리 분리막), SK어스온(자원개발·CCS) 등 미래 유망 사업을 성공적으로 육성해 사업 전문 자회사로 경쟁력을 확보해왔으며, 에너지 믹스 변화에 맞춰 추가 성장 방향성을 검토 중이다. SK이노베이션은 향후 전동화, 폐기물·소재 재활용 분야와 관련해 자체 보유 기술에 더해 각 분야 글로벌 선도 유망 기업에 지분을 투자하거나 기술·사업 협력을 체결해 관련 프로젝트를 추진할 계획이다. 대전 환경과학기술원의 연구개발(R&D) 역량과 글로벌 네트워크를 활용한 ‘글로벌 오픈 이노베이션’ 체계로 추진력을 강화할 예정이다. SK이노베이션이 지난달 SK㈜와 함께 미국 차세대 소형모듈원자로(SMR) 기업 테라파워와 포괄적 사업 협력을 맺은 것이 대표 사례다. 테라파워는 마이크로소프트 창업자인 빌 게이츠가 지난 2008년 설립한 원전 업계의 혁신 기업이다. SK이노베이션은 이 같은 사례를 확대한다는 전략이다. 김 부회장은 “친환경 포트폴리오 확장을 위해 전동화 영역에서는 원자력(SMR), 전기차 배터리 및 소재, 에너지솔루션 등 다양한 차세대 성장 분야에 주목하고 있다”며 “폐배터리 재활용, 폐자원 활용 등 순환경제 영역에서 신규 성장동력 발굴도 지속해서 이어질 것”이라고 덧붙였다. 이한얼 기자(eol@zdnet.co.kr) ©메가뉴스 & ZDNET, A RED VENTURES COMPANY, 무단전재-재배포 금지"
