,url,content
89,https://v.daum.net/v/20220614190507596,"토종 앱 마켓 원스토어가 구글의 '인앱결제 의무화 정책'으로 인한 반사이익을 톡톡히 누리고 있다. 다른 앱 마켓 보다 낮은 수수료 경쟁력이 부각되고 있어서다. '디아블로' 같은 대작 게임의 최신 시리즈나 국내 최대 음원앱 '멜론'이 연이어 입점하면서 매출 확대가 기대되고 있다. 앞서 원스토어는 지난달 글로벌 거시경제의 불확실성 심화를 이유로 상장을 철회한 바 있는데 이어지는 겹호재를 계기로 상장을 위한 '체력'을 제대로 다지는 모습이다. 지난달 9일 이재환 원스토어 대표가 서울 여의도 페어몬트 앰배서더 서울에서 열린 기자 간담회에서 회사에 대해 설명하고 있다./사진=원스토어 제공 디아블로 등 대작 게임 입점 이어져 14일 업계에 따르면 원스토어는 이달 초 블리자드의 최신작 '디아블로 이모탈'을 입점시켰다. 이 게임은 블리자드가 중국 개발사 넷이즈와 협업해 만든 것이다. 디아블로는 세계적인 신드롬을 일으켰던 대작 게임이다. 2000년에 출시한 디아블로2는 1500만장, 2012년에 선보인 디아블로3는 3000만장 넘게 판매되는 기록을 남겼다. 원스토어는 지난해 8월 블리자드와 전략적 파트너십을 체결하고 협력관계를 구축해왔다. 블리자드는 원스토어에 세계 1위 모바일 카드게임 '하스스톤'에 이어 디아블로 이모탈을 연달아 입점시켰다. 원스토어는 게임에 특화한 앱마켓이다. 게임 수수료가 다른 구글이나 애플 앱스토어에 비해 상대적으로 저렴하다. 원스토어는 지난 2018년 7월 업계 최초로 앱마켓 수수료를 30%에서 20%로 낮추고 자체 결제를 허용(5% 수수료)했다. 결제 할인 등으로 인해 모바일 게임에 돈을 많이 쓰는 '헤비유저'가 많은 것도 특징이다. 디아블로 이모탈이라는 글로벌 대작 게임을 입점시킬 수 있었던 것에는 이러한 요인이 경쟁력으로 작용했다는 분석이다. 무엇보다 원스토어의 정책은 구글의 인앱결제 의무화 시행과 맞물려 주목받고 있다. 구글은 이달부터 인앱결제를 의무화하는 정책을 시행하고 있다. 이 정책을 따르지 않으면 구글플레이에서 삭제 조치될 수 있다. 원스토어에 입점하는 대작이 더 늘어날 수 있다는 전망이 나온다. 지금까지 국내 게임사들은 구글·애플 앱 마켓 위주로 입점해왔다. 추가 개발 비용을 들여 원스토어에 입점하기에는 시장 점유율이 높지 않고 글로벌 서비스에도 한계가 있었기 때문이다. 이에 원스토어는 동남아·유럽 등 글로벌 시장을 개척해 입점률을 높일 계획이다. 원스토어 관계자는 ""'헌터W'와 함께 컴투스 '서머너즈 워: 크로니클' 등 주요 타이틀이 입점했고 다른 대작 게임의 입점도 논의 중""이라며 ""지난해 과학기술정보통신부·게임사들과 입점을 위한 협약을 맺은 만큼 원스토어에 입점하는 대작은 점점 늘어날 것""이라고 했다. 미디어·콘텐츠 수수료 인하 카드 꺼내 원스토어는 최근 인앱결제를 의무화한 경쟁사 구글을 겨냥해 미디어·콘텐츠 카테고리에 대한 기본 수수료를 20%에서 10%로 대폭 인하하는 묘수를 뒀다. 기존 소비자 가격을 유지하거나 타 앱마켓 대비 일정 수준 이상 낮은 가격을 책정하는 미디어·콘텐츠 앱에 대해서는 거래액 규모나 구독 비중에 상관없이 6%까지 수수료를 깎아주기로 했다. 이 프로그램은 50개 이상의 콘텐츠 제공자들에게 소비자들의 결제금액을 정산하는 '미디어콘텐츠 플랫폼 앱'을 대상으로 시행된다. 회사 측은 이에 대해 ""최근 글로벌 앱마켓 사업자의 횡포로 미디어콘텐츠 서비스 사업자들이 가격을 인상할 수밖에 없고 이로 인해 소비자들의 부담이 커지는 악순환을 차단하기 위해 전격적으로 시행하는 조치""라고 설명했다. 원스토어가 수수료 인하 정책은 국내 최대 음원 플랫폼 멜론을 입점시키는 성과를 거뒀다. 카카오 계열인 멜론은 그동안 네이버가 주요 주주(25.45%)로 있는 원스토어에 앱을 입점시키지 않았었다. 하지만 구글이 인앱결제를 의무화함에 따라 이에 대한 대안으로 원스토어 입점을 결정한 것으로 풀이된다. 원스토어에 입점하는 앱이 늘어남에 따라 실적 개선에도 청신호가 들어왔다. 원스토어는 지난해 2020년 대비 38%의 높은 성장세를 기록했으나 아직 영업적자를 벗어나지 못하고 있다는 점이 약점으로 지목됐다. 지난해 영업손실 57억원을 기록했다. 원스토어 김상돈 최고재무책임자(CFO)는 지난달 기자간담회에서 ""올해 영업이익 흑자 전환이 가능할 것으로 예상한다""며 ""중장기적으로는 2025년 마진율 10% 이상을 목표로 하고 있다""고 밝힌 바 있다. 이혜선 (hs.lee@bizwatch.co.kr) ⓒ비즈니스워치의 소중한 저작물입니다. 무단전재와 재배포를 금합니다."
90,https://v.daum.net/v/20220613235438393,"암호화폐 이더리움 이미지. © News1 최수아 디자이너 (서울=뉴스1) 김지현 기자 = 시가총액 2위 암호화폐인 이더리움(ETH)이 최근 급락세를 보이고 있다. 시장의 예상치를 웃도는 5월 소비자물가지수(CPI) 결과에 투자심리가 위축된데다 이더리움 기반 파생상품에서 발생한 '뱅크런' 우려가 급락에 직접적인 영향을 미친 것으로 보인다. 13일 코인마켓캡에 따르면 오후 11시 25분 기준, 이더리움은 1219.02달러로 전일 대비 15.35%, 일주일 전보다 36.04% 급락했다. 이더리움의 1300달러선이 무너진 것은 지난해 2월 이후 처음이다. 지난 10일(현지시간) 미국 노동부에 따르면 5월의 소비자물가지수(CPI)는 전년 대비 8.6% 상승했는데 이는 월스트리트저널(WSJ)과 다우존스가 집계한 시장 예상치인 8.3%를 웃돈 수준이다. 해당 수치 발표 이후 이더리움은 눈에 띄는 반등 없이 계속해서 하락세를 보이고 있다. 투자자들이 '이더리움이 위기에 봉착했다'라고 우려하는 주된 이유는 극심한 인플레이션에 따른 영향보다는 이더리움 관련 암호화폐 대출 플랫폼인 셀시우스에서 발생한 뱅크런 압박 때문이다. ◇ ETH 대출 서비스 진행한 셀시우스, '손실 숨김' 의혹받자 상환 요구 빗발쳐 셀시우스는 stETH라는 디파이 플랫폼 리도(Lido)에서 발행한 코인을 담보로 맡기면 70%가량 이더리움을 대출해주는 서비스를 진행해왔다. stETH는 리도에 이더리움 스테이킹을 맡겼다는 일종의 증표와 같은 것인데 이는 ETH와 1 대 1로 가격이 고정된다. 투자자들은 리도에서 이더리움을 대신으로 받은 stETH으로 셀시우스에서 이더리움으로 대출할 수 있다. 이 과정을 통해 받은 이더리움을 다시 리도에 맡겨 stETH를 받으면 또다시 이를 셀시우스에서 이더리움을 대출할 수 있었기 때문에 투자자들은 이자율을 극대화하기 위해 이러한 서비스를 반복적으로 사용했다. 이 과정에서 리도도 이더리움 스테이킹에 대한 몸집을 키워왔다. 문제는 최근 셀시우스가 '더티버블미디어' 등 업계 구성원으로부터 지난 1년간 800억원에 해당하는 손실을 고객에게 숨겼다는 의혹을 받자 다수의 고객들이 셀시우스 측에 ETH의 상환을 요구하는 경우가 생겼다. stETH을 이더리움으로 교환하지 못하는 사태가 발생할 수 있다는 우려 때문이다. 이 과정에서 셀시우스가 고객에게 환급해야 할 stETH과 이더리움의 유동성 풀 사이에서 불균형이 발생했다. 이는 결과적으로 stETH의 가격이 급락하는 문제를 초래했다. 실제 최근 디파이 플랫폼 커브에서 stETH의 가격이 상대적으로 크게 떨어져 ETH과 1대1 교환이 되지 않는 현상까지 발생했다. 두 코인의 1대 1 고정 가격이 깨질 경우 '테라 사태'처럼 뱅크런 사태가 벌어질 수도 있다. 그럴 경우 stETH 가격은 계속해서 급락할 것이고 이더리움을 빌린 사람들의 담보도 청산될 수 있다. 이는 서비스를 진행해왔던 셀시우스도 마찬가지다. 셀시우스는 리도 등 다른 디파이 플랫폼에 예치해 그 이자를 고객들에게 배분하는 방식으로 자금을 운용했는데 투자자들의 인출 요구가 밀려들어오자 거래 중인 다른 디파이에서 자금을 빼서 이를 충당해야 하는 상황까지 직면했다. 웹3 애널리스트 '스몰캡사이언티스트'는 이와 관련해 ""셀시우스가 stETH의 상환을 요구하는 투자자들에게 환급해야 할 ETH이 빠르게 고갈되고 있다""면서 ""막대한 슬리피지 손실과 많은 부채로 인해 셀시우스가 stETH를 매도하거나 추가 대출을 받기는 어려워 보인다""고 밝혔다. 그러면서 ""최악의 상황은 ETH와 stETH간 디페깅이 심화되면서 셀시우스가 청산당하는 것""이라며 ""이미 이를 눈치챈 고래들은 탈출을 시도하고 있다""고 지적했다. 13일 서울 서초구 빗썸 고객센터 전광판에 이더리움 시세가 나타나고 있다. 2022.6.13/뉴스1 © News1 이성철 기자 ◇ 셀시우스, '테라 사태' 같은 뱅크런 발생 우려해 출금 중단 조치 셀시우스는 '테라 사태'에서 발생한 '뱅크런' 사태의 재현을 우려해 13일 출금 중단이란 강수를 뒀다. 셀시우스는 13일 공식 블로그에 ""극단적인 시장 상황으로 인해 출금, 스왑, 계정간 이체를 모두 중단한다""고 밝혔다. 이들은 ""유동성을 안정시키는 것이 궁극적인 목표""라며 “커뮤니티의 이익을 위해 행동하는 것이 최우선 과제""라고 했다. 셀시우스는 출금 재개 일정에 대해서는 아직 밝히지 않았다. 셀시우스가 청산을 당할 경우 이더리움의 전체 스테이킹 규모 중 32%를 차지하는 리도에 타격이 불가피하다. 리도는 출처를 알 수 없는 물량인 약 444만개를 제외하고서 약 412만개로 가장 많은 이더리움을 가지고 있다. 리도에 셀시우스의 뱅크런 여파가 퍼질 경우, 폭락세를 보이는 이더리움의 가격 낙폭에 더욱 큰 영향을 미칠 수 있다. 또 이더리움 디파이 생태계에 대한 타격은 물론 암호화폐 시장이 좀처럼 반등하거나 상승하지 못하는 '크립토 윈터(Crypto Winter)' 시기를 더 오랫동안 겪을 수 있다는 지적도 나온다. mine124@news1.kr Copyright ⓒ 뉴스1코리아 www.news1.kr 무단복제 및 전재 – 재배포금지"
91,https://v.daum.net/v/20220613234930360,"(지디넷코리아=김익현 미디어연구소장)세계 최대 암호화폐 비트코인 가격이 2만4천 달러도 붕괴되면서 2020년 12월 이후 18개월 만에 최저 가격을 기록했다. 암호화폐 비트코인 거래 가격이 13일 오전 10시(미국 동부시간 기준, 한국시간 오후 11시) 2만3325달러까지 하락했다고 CNBC가 전했다. 이 같은 거래 가격은 24시간 전보다 15% 떨어진 것이다. 암호화폐 거래 가격이 지난 주말부터 월요일까지 계속 하락하면서 전체 시가총액 2천 억 달러(약 258조원)이 사라졌다. 이에 따라 암호화폐 시가총액도 2021년 2월 이후 처음으로 1조 달러 밑으로 내려갔다고 CNBC가 전했다. 이날 암호화폐가 폭락한 것은 미국의 5월 소비자물가지수(CPI)가 예상보다 높게 나오면서 위험자산에 대한 투자심리가 얼어붙은 것과 관련이 있는 것으로 풀이된다. 이와 함께 미국 연방준비제도가 이번 주 인플레이션 통제를 위해 이자율을 인상할 것이라는 전망도 암호화폐 투자 열기에 악재로 작용했다. 김익현 미디어연구소장(sini@zdnet.co.kr) ©메가뉴스 & ZDNET, A RED VENTURES COMPANY, 무단전재-재배포 금지"
92,https://v.daum.net/v/20220613232647236,"(지디넷코리아=이한얼 기자)환경부는 우리나라가 4년 만에 '유네스코 인간과 생물권계획'(MAB) 부의장국가로 선출됐다고 13일 밝혔다. 이날 환경부에 따르면 프랑스 파리 유네스코 본부에서 열린 제34차 ‘유네스코 인간과 생물권 계획(MAB)’ 국제조정이사회에서 우리나라가 아시아·태평양지역 대표이자 부의장국가로 재선출됐다. 이번 ‘유네스코 인간과 생물권 계획’ 이사회에서 신임 의장단(의장 1, 부의장 5) 국가가 선출됨에 따라 우리나라는 지난 2016년 제28차 유네스코 국제조정이사회에서 부의장국으로 선출돼 2년간 활동한 이후 4년 만에 다시 임무를 맡게 됐다. 이날 신임 의장국에는 나이지리아가 재선출됐으며, 나머지 부의장국은 우리나라를 포함해 포르투갈, 우크라이나, 엘살바도르, 모르코 등 5개 국가가 선출됐다. 정부세종청사 환경부 전경 ‘유네스코 인간과 생물권 계획’ 국제조정이사회 의장단은 유네스코 생물권보전지역(Biosphere Reserves) 신규 지정, 관리방안 수립·점검 등에 관한 결정을 하는 최고 의사 결정 기구로, 우리나라는 앞으로 2년간 부의장직을 수행한다. 우리나라는 2003년 10월 유네스코 총회에서 처음으로 ‘유네스코 인간과 생물권 계획’ 이사국으로 선출됐으며, 2008년과 2016년에는 부의장국, 2010년에는 의장국으로 활동한 바 있다. ‘유네스코 인간과 생물권 계획’ 한국위원회 공동위원장인 김종률 환경부 자연보전국장은 “유네스코 인간과 생물권 계획 부의장국 선출을 계기로 국제적 위상이 높아질 것으로 기대한다”라며, “앞으로도 유네스코 회원국과 유기적으로 교류·협력하고, 국제보호지역 관리역량 강화에 중추적인 역할을 할 것”이라고 말했다. 이한얼 기자(eol@zdnet.co.kr) ©메가뉴스 & ZDNET, A RED VENTURES COMPANY, 무단전재-재배포 금지"
93,https://v.daum.net/v/20220613231907182,"[앵커] 내일 발사대로 향해야 할 누리호의 일정에 변수가 생겼습니다. 날씨가 좋지 않아서인데, 비행시험위원회는 이송 여부를 유보한 채 내일 새벽에 다시 판단하기로 했습니다. 이성규 기자가 보도합니다. [기자] 누리호는 3단의 완성된 모습에서 최종 점검을 마친 뒤 조립 동에서 대기 중입니다. 예정대로라면 내일 발사대로 옮기고 모레 발사가 이뤄져야 합니다. 하지만 이 일정에 제동이 걸렸습니다. 항공우주연구원 전문가로 구성된 비행시험위원회는 내일 날씨가 무척 유동적이어서 이송 여부 판단을 유보한다고 밝혔습니다. [권현준 / 과학기술정보통신부 거대공공연구정책관 : 현재 고흥 지역에 바람이 거세서, 내일 발사대 타워에서 작업하는 데 안전상의 문제가 있을 수 있다는 결정이 났습니다.] 내일 새벽 기상 상황을 보고 다시 비행시험위원회를 열어 이송 여부를 판단할 계획입니다. 누리호가 예정대로 이송이 결정된다면 오전 7시 20분, 조립 동을 나와 무진동 차량에 실려 발사대로 이송됩니다. 이어 수요일인 모레 오후 발사됩니다. 만일 이송이 연기되면 날씨를 볼 때 하루 연기가 유력합니다. 이 경우 수요일 오전 이송, 목요일 오후 발사라는 새로운 일정이 잡힐 가능성이 큽니다. YTN 사이언스 이성규입니다. YTN 이성규 (sklee95@ytn.co.kr) ※ '당신의 제보가 뉴스가 됩니다' [카카오톡] YTN 검색해 채널 추가 [전화] 02-398-8585 [메일] social@ytn.co.kr 저작권자(c) YTN & YTN plus. 무단 전재-재배포 금지"
94,https://v.daum.net/v/20220613222006892,"구글이 이달부터 자사 인앱결제 정책을 따르지 않는 애플리케이션(앱)을 플레이스토어에서 삭제하기로 했지만, 일부 앱들은 이를 따르지 않고 있는 것으로 나타났다. 카카오톡이 이모티콘 구독 결제창에 웹 결제가 가능한 아웃링크를 걸어놓았고, 넷플릭스는 아예 앱에서 회원가입·결제를 할 수 없게 해놓았다. 구글과 소송을 벌이고 있는 개발사의 앱들도 구글 정책 적용 유예를 받고 있다. 구글이 해당 업계 지배력이 있거나 구글에 강경 대응하는 앱들에 인앱결제의 예외를 두면서 ‘강약약강’(강자에게 약하고 약자에게 강한) 행태라는 지적이 나온다. 13일 카카오에 따르면 카카오톡에서 무제한으로 이모티콘을 사용할 수 있는 ‘이모티콘 플러스’ 구독 페이지에 ‘웹에서는 월 3900원의 가격으로 구독할 수 있다’는 안내 문구가 걸려 있다. 웹 결제로 통하는 아웃링크도 추가했다. 앞서 구글은 국내 앱 개발사에 외부 결제 페이지로 연결되는 아웃링크를 앱에서 삭제하지 않으면 이달 1일부터 앱을 삭제한다고 공지했다. 인앱결제(최대 수수료 30%)를 사용하거나, 인앱결제 내 제3자결제 시스템(최대 수수료 26%)을 구축하지 않으면 앱을 구글플레이에 등록할 수 없는 것이다. 웹 결제를 안내하거나 독려하는 표현조차 사용하지 못하도록 금지하고 있다. 구글이 내민 기준대로라면 카카오톡은 구글플레이에서 삭제될 수 있다. 정보기술(IT) 업계에서는 국내 앱시장에서 영향력이 큰 카카오가 공개적으로 구글에 반기를 든 것 아니냐는 관측도 나온다. 카카오 관계자는 “최소 6월 이전에라도 이용자에게 기존 가격대로 구매할 수 있는 방법을 안내할 필요가 있다고 판단해 웹 결제 링크를 추가해 지난 5월 말 업데이트를 진행했다”며 “현재 이와 관련해 공식적으로 구글에서 통보받은 바가 없으며, 구글에서 연락이 오면 관련 사항을 내부 검토할 예정”이라고 밝혔다. 구글은 한국을 비롯한 대다수 나라들에서 자사의 인앱결제 정책을 요구하고 있다. 하지만 카카오 사례처럼 해외에서도 영향력 있는 앱들은 구글 정책을 따르지 않고 있다. 온라인동영상서비스(OTT) 1위 업체인 넷플릭스는 앱에서는 회원가입과 결제 기능을 막고, 웹에서만 가능하도록 해놨다. 사실상 구글에 ‘통행세’를 전혀 내지 않아도 되는 것이다. 데이팅 앱을 운영하는 미국의 ‘매치 그룹’은 구글 인앱결제 정책에 반대하며 미 법원에 소송을 제기했고, 재판이 끝날 때까지 구글 정책 적용 유예를 받는다. 국내 앱 개발사 관계자는 “국내 대다수 앱들은 구글 플레이스토어에서 앱이 삭제됐을 경우 피해가 크고 소송을 해 승소하더라도 오랜 시간이 걸려 재기가 불가능하게 된다”면서 “절대 갑인 구글의 요구에 힘없는 앱들은 따를 수밖에 없는 실정”이라고 말했다. 이윤정 기자 yyj@kyunghyang.com ⓒ 경향신문 & 경향닷컴(www.khan.co.kr), 무단전재 및 재배포 금지"
95,https://v.daum.net/v/20220613221425834,"-국제 표준 안전성 시험 통과 -국내 최초 도심지 순찰 만도가 자율주행 순찰 로봇 '골리 Ⅱ'를 활용해 관악구 빌라촌에 전격 투입했다고 13일 밝혔다. 이번에 새롭게 등장한 골리Ⅱ는 20년 7월 시흥 배곧생명공원에서 운행을 시작한 1세대 골리에 대를 잇는 차세대 버전이다. 서울 한복판 시민 곁에 성큼 다가서며 국내 최초 도심지 자율주행 순찰 로봇이다. 장애물 충돌, 대인 상호접촉 등 안전성 관련 국제표준 시험을 통과해 세이프티 성능을 공인 받은 골리Ⅱ는 자율주행 순찰 역량도 도심지에 알맞게 업그레이드 됐다. 먼저 5G를 통한 실시간 관제센터 통신은 물론 라이다, 카메라를 서라운드로 장착한 골리Ⅱ의 인지능력은 1세대 골리 보다 두 배 이상 높아졌다. 2세대 골리의 인공지능(AI) 기능이 진일보한 이유다. 야간 순찰 강화를 위해 열화상 카메라도 추가 적용 됐다. 이를 통해 CCTV 사각지대 등 치안 취약 지점도 집중적으로 감시할 수 있다. 최성호 만도 모빌리티 솔루션 테크 그룹장은 ""만도의 자율주행 로봇 기술이 대중에게 더 현실적으로 다가갈 수 있도록 최선을 다하겠다""며 ""스마트 폴리스 시대가 눈앞에 다가온 것만큼 골리의 활용 범위와 사업 기회도 빠르게 확대될 것으로 기대하고 있다""고 밝혔다. 김성환 기자 swkim@autotimes.co.kr 자동차 전문 매체 1위 오토타임즈"
