,url,content
219,https://v.daum.net/v/20220611120102341,"과학기술정보통신부가 국가필수전략기술 중 하나인 이차전지를 비롯한 수소연료전지, 동위원소전지 등 차세대 전지 분야 초격차 기술 선점을 위해 '차세대 전지 초격차 R&D 전략(가칭)' 수립에 착수한다. 과기정통부는 산·학·연 전문가로 구성된 기획총괄위원회를 구성하고 하반기 중 이번 전략을 마련 및 발표할 계획이다. 현재 전지 분야는 리튬이온전지를 중심으로 시장이 형성돼 있지만, 리튬이온전지는 이론적 용량 성능 및 가격 한계에 다다르고 있어 에너지 밀도가 높은 전고체전지, 경제성이 높은 나트륨이온전지 및 해수전지 등 차세대 전지에 대한 기술 개발 필요성이 커지고 있다. 또 수소를 활용해 장기간 저장 후 전기에너지로 활용 가능하며 초대형화에 유리한 수소연료전지와 우주, 극지 등 극한 환경에서 활용될 특수목적용 전지 시스템 필요성도 커지고 있어 이에 대한 초격차 기술 선점을 위한 전략이 필요한 시점이다. 이창윤 과기정통부 기초원천연구정책관은 “국가필수전략기술 및 국정과제에 포함된 이차전지를 중심으로 수소연료전지, 동위원소전지 등 다양한 용도의 차세대 전지 초격차 기술 확보를 목표로 이번 전략을 수립할 것”이라며 “전문가 및 기업 의견을 폭넓게 수렴하고 인력양성, 인프라 활용 등을 포함하는 실효성 있는 전략을 마련할 계획”이라고 말했다. 이인희기자 leeih@etnews.com Copyright ⓒ 전자신문 & 전자신문인터넷, 무단전재 및 재배포 금지"
220,https://v.daum.net/v/20220611120032336,"[아이뉴스24 장가람 기자] 네이버웹툰의 인기 웹소설 '키스 식스 센스'가 웹툰에 이어 드라마로 제작되며, 이용자들에게 색다른 즐거움을 선사하고 있다. 웹소설 '키스 식스 센스'가 디즈니+의 오리지널로 독점 공개되며, 색다른 즐거움을 선사하고 있다. 사진은 웹소설 키스 식스 센스 관련 이미지. [사진=네이버웹툰] 웹소설 '키스 식스 센스'는 갓녀 작가가 지난 2019년 연재를 시작한 로맨스물이다. 입술이 닿으면 '예술'과 지나치게 예민한 오감을 지닌 직장 상사 '민후' 사이에 벌어지는 에피소드를 담았다. 오감과 육감, 현재와 미래를 오가는 독특한 설정과 이야기로 웹소설 연재 당시에도 인기를 끌었다. 지난 4월부터는 동명의 웹툰이 네이버 웹툰에서 인기리에 연재되고 있다. 글로벌 서비스를 통해 영어와 인니어, 스페인어 등 총 6개 언어로 해외에도 연재되고 있다. 글로벌 인기에 힘입어 웹소설과 웹툰의 누적 조회수는 1억6천만 뷰를 넘긴 상태다. 지난달 25일부터는 월트디즈니의 온라인동영상서비스(OTT) '디즈니+'에서 12부작 드라마로 제작돼 방영 중이다. 12부작 중 현재 6회까지 공개됐다. 앞서 디즈니+는 지난해 OTT 서비스 출시 전 '디즈니플러스 미디어데이 & APAC 콘텐츠 쇼케이스'를 통해 '키스 식스 센스'의 오리지널 드라마 제작 소식을 알린 바 있다. 드라마 '키스 식스 센스'는 '뷰티 인사이드', '오 마이 베이비' 등을 연출한 남기훈 감독이 메가폰을 잡고 '라디오 로맨스'를 집필한 전유리 작가가 함께했다. 주인공 예술에는 서지혜 배우가, 민후는 윤계상 배우가 분했다. 극에 긴장감을 주는 예술의 전 남자친구는 김지석 배우가 맡았다. 한편 네이버웹툰은 디즈니+ 공개에 맞춰 프랑스어와 독일어로 연재를 확대할 계획이다. /장가람 기자(jay@inews24.com) Copyright ⓒ 아이뉴스24. 무단전재 및 재배포 금지"
221,https://v.daum.net/v/20220611115919311,"(지디넷코리아=김한준 기자)라이엇게임즈의 PC MOBA 게임 리그오브레전드에 160번째 신규 캐릭터 벨베스가 지난 10일 업데이트 됐다. 벨베스는 룬테라 전역을 장악하고 자신의 뒤틀린 상상에 따라 세계를 재건하려 하는 캐릭터로, 대형 몬스터 또는 챔피언 및 에픽 몬스터 처치에 관여하면 ‘연보라’ 중첩을 쌓아 공격 속도를 영구히 증가시키는 패시브를 갖고 있다. 특히 스킬을 사용한 뒤 다음 두 번의 공격 속도가 증가하는 것이 특징이다. 벨베스의 첫 번째 스킬 ‘공허 쇄도’는 경로에 위치한 적에게 피해를 입히는 돌진기다. 두 번째 스킬 ‘위와 아래’는 짧은 시간 적을 공중으로 띄우고 둔화시킴은 물론, 적 챔피언에게 적중 시 ‘공허 쇄도’ 재사용 대기 시간이 줄어드는 효과도 갖고 있다. ‘여제의 소용돌이’는 정신 집중 상태가 되어 주변에 칼바람 소용돌이를 일으키며, 범위 내 가장 체력이 낮은 적을 벨 때마다 대상이 잃은 체력에 비례한 피해를 입히는 스킬이다. 궁극기 ‘끝없는 연회’는 챔피언과 에픽 몬스터 처치에 관여하면 공허 산호 조각이 떨어지며, 같은 대상을 두 번 공격할 때마다 무한히 중첩되는 고정 피해를 추가로 입히는 기본 지속 효과를 갖고 있다. 또한 벨베스가 공허 산호 조각을 소모할 경우 벨베스는 잠시 본모습으로 변신해 전투를 펼칠 수 있다. 만약 협곡의 전령 또는 내셔 남작이 남긴 공허 산호를 소모할 경우 변신 지속시간이 늘어나며 주변에서 죽는 미니언을 공허충으로 되살리는 것도 가능하다. 빠른 공격 속도를 자랑하는 벨베스는 안정적으로 성장할 수만 있다면 팀의 승리에 크게 기여할 수 있는 잠재력을 가진 챔피언이다. 기본 지속 효과의 공격 속도 스택에 제한이 없는 데다, 궁극기를 통해 순간적으로 스펙도 크게 올릴 수 있기 때문. 1대1 대결에 강한 만큼 경기 후반 사이드 주도권을 잡을 수 있다는 점도 벨베스의 강점으로 꼽힌다. 신규 챔피언 벨베스에 대한 보다 상세한 이야기는 리그오브레전드 공식 홈페이지에서 확인할 수 있다. 김한준 기자(khj1981@zdnet.co.kr) ©메가뉴스 & ZDNET, A RED VENTURES COMPANY, 무단전재-재배포 금지"
222,https://v.daum.net/v/20220611115224269,"(지디넷코리아=김한준 기자)ZEP(대표 김원배)은 자사 메타버스 플랫폼 'ZEP(젭)'의 출시 이후 성과와 앞으로의 비전을 지난 10일 공개했다. ZEP은 슈퍼캣과 네이버제트의 합작법인 ZEP이 운영하는 동명의 메타버스 플랫폼으로 지난해 11월 베타 버전을 공개했으며, 올해 3월 정식 서비스 시작을 알렸다. ZEP을 대중에 공개한 후 만 6개월이 지난 현재 ZEP에 접속한 누적 사용자는 100만 명을 넘었고, 스페이스(ZEP 내 메타버스 공간) 참여수는 1천100만 회를 돌파했다. 사용자 메타버스 공간인 스페이스는 약 11만 개가 생성되었으며, 월간 활성 사용자는 34만 명에 달한다. 특히 ZEP은 지난달 19일에 메타버스 내 앱 개발 기능을 담은 '젭 스크립트' 기능을 추가해 사용자들에게 좋은 반응을 얻고 있다. 젭 스크립트 기능을 활용하면 메타버스 내에서 새로운 게임이나 생산성 앱 등을 창작할 수 있는 확장성이 대폭 늘어나게 된다. ZEP 관계자는 “사용자들이 ZEP 내에서 직접 만든 앱과 게임을 사고팔 수 있는 ‘앱 스토어’를 ZEP에 추가할 예정”이라고 밝혔다. 이는 ZEP 내 생태계 구축을 위해 선보였던 ‘에셋 스토어’에 이은 추가적인 C2E 요소 업데이트로, 많은 창작자가 유입될 수 있는 기반을 마련하기 위한 조치다. 다양한 기업들의 활용도 돋보인다. 삼성전자는 ZEP을 통해 신입사원 채용 박람회와 오리엔테이션을, 롯데그룹은 ZEP에 채용 전문관 '엘-리크루타운'을 개설했다. 빅히트 뮤직 소속 아티스트 투모로우바이투게더는 ZEP에서 팬 이벤트 ‘PLAY X TOGETHER(플레이 바이 투게더)’를 개최했으며, 네이버는 '검색 콜로키움 2022'를 ZEP에서 동시 진행하기도 했다. 이 밖에도 GS건설, JTBC, 서울특별시 등의 기업, 단체에서 ZEP을 통해 색다른 공간을 바탕으로 한 다양한 이벤트를 제공하고 있다. 또, ZEP은 블록체인, NFT 기술을 연동한 메타버스 구현을 통해 나이팅게일코리아, 노레이턴시, 퍼즐몬스터즈, 클레이킹덤, 샌드박스네트워크 등의 블록체인, NFT 프로젝트와 MOU를 진행했으며 이를 기반으로 한 다양한 협업 활동을 활발히 전개하고 있다. ZEP 팀의 김상엽 리더는 “모두를 위한 메타버스를 기치로 모든 팀원이 함께 달려온 결과 단기간에 누적 사용자 100만 명이라는 뜻깊은 성과를 달성할 수 있어 매우 기쁘다”라며 “오프라인에서만 할 수 있었던 경험을 ZEP이라는 새로운 공간에서 느낄 수 있게 혁신시켜 현실보다 나은 경험을 줄 수 있게 업데이트해 나갈 계획이다”라고 밝혔다. 김한준 기자(khj1981@zdnet.co.kr) ©메가뉴스 & ZDNET, A RED VENTURES COMPANY, 무단전재-재배포 금지"
223,https://v.daum.net/v/20220611114925250,"(지디넷코리아=김한준 기자)에이블게임즈가 모바일 방치형 RPG 달토끼 키우기를 글로벌 출시했다고 지난 10일 밝혔다. 달토끼 키우기는 미국, 캐나다를 포함한 북아메리카 지역과 유럽, 오세아니아 등 총 46개국에 출시하며 전세계 170여개국에 서비스를 시작했다. 또한 글로벌 출시와 함께 iOS 버전 달토끼 키우기가 출시 됐으며 신규 이용자가 더 쾌적한 환경에서 게임을 즐길 수 있도록 새로운 서버를 오픈했다. 한국의 전래동화를 바탕으로 제작된 달토끼 키우기는 달의 왕국을 수호하기 위해 빼앗긴 빛을 찾아 밤과 맞서 싸우며 성장하는 모바일 2D 방치형 RPG이다. 달토끼 키우기는 지난해 6월 국내 출시 이후 시뮬레이션 장르 매출 1위를 기록 하는 등 꾸준한 성장세를 기록하고 있으며, 지난달에는 글로벌 소프트 런칭을 통해 태국 시뮬레이션 장르 최고 매출 1위, 베트남 시뮬레이션 장르 최고매출 5위를 달성했다. 에이블게임즈 담당자는 ""달토끼 키우기가 작년 출시 이후 1년만에 전세계 170여개국에 서비스하는 글로벌 게임으로 발전했다. 이는 모두 게임을 아끼고 함께 성장해온 이용자의 사랑 덕분이다""라며, ""글로벌 그랜드 런칭과 함께 한국에서는 서비스 1주년을 맞이했다. 이를 기념해 대규모 업데이트와 다양한 이벤트도 준비했으니 마음껏 즐겨주시길 바란다""고 전했다. 김한준 기자(khj1981@zdnet.co.kr) ©메가뉴스 & ZDNET, A RED VENTURES COMPANY, 무단전재-재배포 금지"
224,https://v.daum.net/v/20220611113017105,"[최종수 토지주택연구원 연구위원] 두 차례에 걸친 왕자의 난을 통해 정적을 제거하고 권력을 잡았던 조선 태종. 세종에게 왕위를 넘겨주고 상왕 신분이 된 그는 오랜 가뭄으로 백성들의 삶이 도탄에 빠지고 역병마저 창궐하고 있다는 말을 듣고 궁궐 후원에 단을 쌓고는 홀로 기우제를 지냅니다. (사진=이미지투데이) 지병이 깊어 죽음이 얼마 남지 않았음을 직감한 태종은 기우제를 지내면서 감정이 복받쳐 그간 자신의 악업을 절규하듯 토해내며 비를 내려달라고 간절히 기도합니다. 며칠간 밤낮으로 이어진 태종의 기우제는 절규를 넘어 광기에 가까워집니다. 기우제가 계속되던 어느 날 밤, 천둥이 치기 시작하면서 비가 쏟아집니다. 태종은 그 빗속에서 자신의 아버지인 이성계를 그리며 “아버지, 아버...”라는 말을 마지막으로 숨을 거둡니다. 종영한 지 20년도 넘게 지났지만 사극 최고의 명장면으로 기억되고 있는 KBS 대하사극 ‘용의 눈물’의 마지막 장면입니다. 이날이 세종 4년인 1422년 음력 5월 10일이었습니다. 이후로도 태종의 기일인 음력 5월 10일이면 비가 내린다고 해 태종이 내리는 비라는 의미로 태종우라고 하였습니다. 드라마 제목처럼 ‘용의 눈물’에 비유한 것이지요. 지난 8일 전국에는 소나기가 있었습니다. 이날이 음력 5월 10일이었습니다. 태종우가 내린 걸까요? 과거 농경사회에서 비는 기상현상 이상의 존재였습니다. 가뭄으로 흉년이 들면 백성의 생존이 위협받는 건 물론이고 임금의 통치권도 위태로워졌습니다. 임금은 하늘이 내리고 비는 하늘이 관장한다고 생각했기 때문에 자연재해는 모두 통치권자가 부덕한 탓이었습니다. 비를 기다리는 백성들 마음도 타들어 가지만 기우제를 지내는 통치권자도 절박하기는 마찬가지였습니다. 태종이 비가 올 때까지 며칠에 걸쳐 기우제를 지냈던 것처럼 다른 나라의 기우제도 상황은 비슷했을 것입니다. 기우제는 하늘이 감복하도록 간절하게 정성을 다해 지내야 합니다. 하늘을 감동시키기 위해서는 하늘로부터 권한을 받은 임금이 기우제를 지내는 것이 당연한 일이지만 임금이 직접 제를 올렸다는 기록은 많지 않습니다. (사진=이미지투데이) 왜 그랬을까요? 임금이 직접 지내는 기우제는 위험부담이 있습니다. 만일 기우제를 지냈는데도 비가 오지 않으면 하늘로부터 버림받은 임금이라는 소문이 돌아 민심은 걷잡을 수 없이 흉흉해질 게 뻔했기 때문입니다. 조선왕조실록의 기우제에 대한 기록을 보면 신하를 보내 기우제를 지냈다는 내용이 대부분입니다. 불가피하게 임금이 직접 기우제를 지내게 되면 반드시 비가 오는 기우제가 돼야 합니다. 비가 올 만한 날을 잡아 기우제를 시작해야 했고 일단 시작되면 비가 오기 전까지는 중단하기 어려웠을 겁니다. 기우제를 그만둘 명분도 마땅치 않고 비가 오기 전에 기우제를 그만두면 하늘의 버림을 받은 임금이 되는 것이니 뒷감당이 만만치 않았겠지요. 이렇게 한번 시작하면 비가 올 때까지 지내는 기우제를 인디언 기우제라고도 합니다. 이 때문에 우리나라에서 인디언 기우제라는 표현은 무슨 일이든 꾸준히 노력하면 반드시 성공한다는 의미로 사용되기도 합니다. 자기계발, 주식투자, 종교 등 여러 분야에서 널리 사용되는 이유입니다. 아이러니하게도 인디언의 고향인 미국에서는 인디언 기우제라는 단어를 찾을 수 없습니다. 아마도 지극 정성으로 기우제를 지냈던 인디언에 대한 얘기가 우리나라에 전해지는 과정에서 ‘지성이면 감천’이라는 우리 정서와 만나면서 생긴 표현이 아닐까 싶습니다. 하늘이 비를 관장한다고 믿었던 옛날 사람들은 하늘에 제를 지내면서 비가 오기를 기원했습니다. 하지만 기상현상을 이해하고 있는 오늘날 우리들은 기우제를 지내는 대신 비행기를 타고 하늘로 올라가 구름에 화학물질을 뿌려 비가 오게 합니다. 바로 인공강우입니다. 인공강우가 우리에게 익숙해진 계기는 2008년 베이징 올림픽이었습니다. 베이징 기상당국은 올림픽 개막식 때 많은 양의 비가 올 것이라 예보했습니다. 비 때문에 개막식을 망칠 것을 우려한 중국 정부는 놀라운 조치를 취합니다. 인공강우 기술을 이용해 비구름이 경기장 근처로 오기 전에 인근 도시에서 미리 비를 쏟아내도록 한 것입니다. 이 놀라운 작전은 성공했고 덕분에 개막식은 성황리에 마무리 지을 수 있었습니다. 인공강우. (이미지=최종수 위원) 인공강우는 구름씨앗이라고 하는 응결핵이 될 만한 물질을 구름 속에 뿌려 수증기를 물방울로 응결시키는 기술을 말합니다. 구름은 머리카락 굵기 4분의 1 정도의 아주 작은 수증기로 이뤄졌는데 2mm 정도의 빗방울이 되려면 구름입자 수백만 개가 모여야 합니다. 구름씨앗을 뿌려주면 이 물질이 응결핵이 되어 구름 속에 있는 수증기를 쉽게 물방울로 만듭니다. 비를 조절하는 인공강우 기술 덕분에 가뭄에 대한 고민을 해결한 것 같지만 풀어야 할 숙제는 아직도 많습니다. 우선 인공강우로 비를 내리기 위해서는 비를 머금은 구름이 있어야 합니다. 인간이 가진 기술은 구름에서 비를 만드는 기술이지 구름을 만드는 마법은 아니기 때문입니다. 뿐만 아니라 인공강우로 특정 지역에 비를 내리면 원래 비가 내릴 지역은 비가 오지 않기 때문에 지역 간 또는 국가 간 분쟁의 원인이 되기도 합니다. 수백억t의 물을 저장할 수 있는 저수시설을 갖춘 지금도 비가 내리지 않으면 전국은 가뭄으로 타들어 갑니다. 인류의 과학기술 발달이 많은 걸 해결한 것 같지만 우리는 여전히 많은 부분을 자연에 의존해 살아가고 있습니다. ■최종수 연구위원(박사·기술사)은 △토지주택연구원 연구위원 △University of Utah Visiting Professor △국회물포럼 물순환위원회 위원 △환경부 자문위원 △행정중심복합도시건설청 자문위원 △대전광역시 물순환위원회 위원 △한국물환경학회 이사 △한국방재학회 이사 이명철 (twomc@edaily.co.kr) ⓒ종합 경제정보 미디어 이데일리 - 무단전재 & 재배포 금지"
225,https://v.daum.net/v/20220610235933290,"[한국경제TV 이휘경 기자] 한국형 발사체 누리호의 발사 예정일 전날인 14일 비가 내릴 것으로 예보돼 한국항공우주연구원(항우연) 전문가들이 상황을 예의주시하고 있다. 항우연 장영순 발사체 책임개발부장은 10일 온라인 설명회에서 ""기상 예보상황으로 보면 14일 오전에 비가 예정돼 있어 기상 상황을 예의주시할 필요가 있다고 생각한다""며 ""발사상황이나 기상 상황에 대해 검토한 뒤에 오는 13일 저녁에 비행시험위원회를 열어 결정을 내릴 것""이라고 밝혔다. 기상청 홈페이지에 따르면 누리호가 발사될 나로우주센터가 위치한 고흥의 14일 오전 강수확률은 60%다. 항우연에 따르면 이날 오전 7시부터 오후 6시 20분까지 누리호를 발사장으로 이송해 기립하는 작업이 예정돼 있다. 장 부장은 ""발사체는 빗물이 들어가지 않도록 실링(sealing, 밀봉)돼 있어 발사하는 데 문제는 되지 않지만, 준비하는 과정에서는 문제가 있을 수 있다""며 ""비가 계속 오거나 노면이 젖어있다면 이송 차량이 비탈길을 잘 못 올라가 미끄러질 수 있다""고 설명했다. 이어 ""계속 비가 오면 안전 문제가 발생할 수 있기 때문에 우천이 예보돼 있으면 검토를 해서 발사체 롤아웃(발사체가 조립동에서 나오는 과정)을 할지 말지 결정해야 한다""며 ""이런 부분은 항우연뿐 아니라 여러 관계기관이 연결돼 있으므로 신중해야 한다""고 전했다. (사진=연합뉴스) 이휘경기자 ddehg@wowtv.co.kr Copyright 한국경제티브이"
226,https://v.daum.net/v/20220610232513142,"[앵커] 오는 15일로 예정된 누리호 2차 발사에 돌발 변수가 등장했습니다. 발사 전날 우주센터에 제법 강한 비가 내릴 것이란 예보가 나온 건데요, 누리호 이송과 기립 과정에 문제가 생길 정도라면 발사 일정이 늦춰질 수도 있습니다. 정혜윤 기자가 보도합니다. [기자] 발사 예정일 하루 전날 누리호는 조립 동에서 나와 발사대로 이동합니다. 무진동 차량에 수평으로 눕혀진 상태로 옮겨지는데, 고불고불하고 경사가 심한 도로를 거쳐야 합니다. 나로호와 누리호 1차 발사까지 맑은 날씨여서 이송에 문제가 없었지만, 2차 발사에 돌발 변수가 등장했습니다. 바로 이송일에 비가 예보된 것입니다. 약한 비는 상관없지만, 폭우가 내리면 미끄럼 사고가 우려되고 전기와 연료 공급 선 연결에도 어려움이 커집니다. [장영순 / 항우연 발사체체계개발부장 : 이송에 제한 조건이 있습니다. 비가 계속 온다거나 노면이 젖어있거나 하면 이송차량이 비탈길을 잘 못 올라가고 미끄러질 수 있는 문제가 있습니다. 계속 비가 오는 상황이라면 여러 안전 문제가 발생할 수 있습니다.] 발사 당일에 내리는 비는 누리호 비행에 지장을 주진 못합니다. 비보다는 오히려 강풍과 낙뢰가 장애물입니다. 바람이 평균 풍속 초속 15m, 순간 최대 풍속 초속 21m가 넘으면 발사가 중지되고 비행경로 상에 번개 방전 현상이 나타나지 않아야 합니다. 또 발사체 이륙부터 위성이 궤도 진입 후 1주기 도는 동안 유인 우주선으로부터 최소 200km 떨어져야 합니다. 확률은 낮지만, 태양흑점 폭발과 같은 우주 물체에 영향을 줄 수 있는 우주환경이 급격히 악화하면 발사가 연기될 수도 있습니다. 현재 발사 당일 날씨와 주변 우주 환경은 발사에 지장이 없는 상황 과기부와 항우연은 오는 13일 저녁 비행시험위원회를 열어 기술적인 상황과 날씨 조건을 검토한 뒤 발사 일정에 대한 최종 판단을 내릴 예정입니다. YTN 정혜윤입니다 YTN 정혜윤 (jh0302@ytn.co.kr) ※ '당신의 제보가 뉴스가 됩니다' [카카오톡] YTN 검색해 채널 추가 [전화] 02-398-8585 [메일] social@ytn.co.kr 저작권자(c) YTN & YTN plus. 무단 전재-재배포 금지"
227,https://v.daum.net/v/20220610220109777,"(지디넷코리아=남혁우 기자)마이크로소프트(MS)가 경쟁관계 기업으로 이직을 금지하는 경쟁금지 조항을 없앤다. 직장 문화 개선을 위한 것으로 급여 투명성 및 직원 보호 조항도 강화한다. 마이크로소프트는 8일(현지시간) 4가지 신규 직원 인력 이니셔티브를 공식 블로그를 통해 발표했다. 마이크로소프트는 지난 2일 사내 노동조합과의 교섭에 합의하고, 노조 결성 의사도 존중하는 등 직원들의 의사를 반영한 움직임을 보이고 있다. (이미지=마이크로소프트) 신규 이니셔티브는 직원 관계를 심화하고 직장 문화를 개선하기 위한 변경 사항으로 경쟁 금지 조항, 분쟁 해결의 기밀 유지 계약, 고용 관행의 투명성, 민권 감사 개시 등이다. 먼저 현재 시행 중인 경쟁금지 조항을 중단해 직원의 자유로운 이동을 보장한다. 직무 계약서에 포함된 경쟁금지 조항은 경쟁관계에 있는 동일계열 기업에 취업하거나 창업하지 않겠다고 동의하는 내용이다. 기업의 민감한 정보가 유출되는 것을 막기 위함이다. 경쟁금지 조항을 중단은 최고 경영진을 제외한 미국 전 지역 직원부터 순차적으로 시작한다. 해당 직원들은 경쟁사로 이직 시에도 경쟁금지 조항에 의해 제한을 받지 않는다. 다만 비즈니스 행동 표준 및 기밀정보 보호 의무에 대한 책임은 유지된다. 개인정보 보호를 강화하고 안전한 업무 공간 조성에 나선다. 임금 체불, 불법 차별, 괴롭힘, 보복, 성폭행 등 비정상적인 직장 문제에 대해 제기하는 것을 장려하기 위함이다. 급여 투명성 향상을 위해 채용 공고에서 급여 범위를 공개할 예정이다. 이 방침은 늦어도 2023년 1월부터 미국 전역에서 시행될 예정이다. 또한 마이크로소프트는 인력 정책 및 관행에 대한 책임감과 투명성 확보를 위해 제3자가 수행하는 민권 감사를 수행한다고 밝혔다. 감사는 회계연도 2023년에 완료하며 요약 보고서와 후속 조치에 대해 공개적으로 게시한다. 마이크로소프트의 에이미 파노니 글로벌 인사 담당 부사장은 “마이크로소프트는 항상 직원의 경험을 평가하고, 직원의 관심을 기울이는 결과로 인해 어떤 변화가 필요한지 결정하기 위해 귀를 기울이고 있다”며 “이번 인력 이니셔티브가 긍정적인 변화라고 믿으며 사람은 회사의 심장이자 영혼이며 최우선 순위라는 기본 원칙을 반영한다”고 전했다. 남혁우 기자(firstblood@zdnet.co.kr) ©메가뉴스 & ZDNET, A RED VENTURES COMPANY, 무단전재-재배포 금지"
